{
  "agent_name": "ml-orchestrator",
  "collaboration_patterns": {
    "delegation_effectiveness": {},
    "frequent_collaborators": [
      {
        "agent_name": "performance-engineer",
        "collaboration_frequency": 8,
        "common_tasks": [
          "training optimization",
          "inference performance"
        ],
        "success_rate": 0.9
      },
      {
        "agent_name": "infrastructure-specialist",
        "collaboration_frequency": 6,
        "common_tasks": [
          "model deployment",
          "container orchestration"
        ],
        "success_rate": 0.875
      },
      {
        "agent_name": "data-pipeline-specialist",
        "collaboration_frequency": 1,
        "common_tasks": [
          "feature engineering optimization"
        ],
        "success_rate": 1.0
      }
    ]
  },
  "domain_knowledge": {
    "common_patterns": [
      {
        "description": "ML model training pipeline optimization and hyperparameter tuning",
        "frequency": 1,
        "pattern_name": "model_training_optimization",
        "success_rate": 0.88
      },
      {
        "description": "Production model registry with @champion, @production, @challenger aliases",
        "frequency": 1,
        "pattern_name": "model_registry_management",
        "success_rate": 0.92
      }
    ],
    "project_specific_context": {
      "architecture_patterns": [
        "Decomposed ML pipeline architecture (5 focused services)",
        "MLPipelineOrchestrator facade pattern",
        "Advanced ML features: context-aware learning, rule optimization",
        "Production model registry with alias-based deployment"
      ],
      "configuration_insights": [
        "God object decomposed: 1,043 lines \u2192 5 services <400 lines each",
        "Context-aware learning for domain-specific optimization",
        "Real behavior testing for ML pipeline validation"
      ],
      "performance_baselines": {
        "inference_latency_ms": 50,
        "model_accuracy_improvement": 0.15,
        "training_time_reduction": 0.6
      }
    }
  },
  "last_updated": "2025-08-15T17:11:04.264134+00:00Z",
  "optimization_insights": [
    {
      "area": "test_area_30",
      "confidence": 0.8,
      "discovered_at": "2025-08-15T17:11:03.945330+00:00Z",
      "impact": "medium",
      "insight": "Test insight 30"
    },
    {
      "area": "test_area_31",
      "confidence": 0.8,
      "discovered_at": "2025-08-15T17:11:03.945331+00:00Z",
      "impact": "medium",
      "insight": "Test insight 31"
    },
    {
      "area": "test_area_32",
      "confidence": 0.8,
      "discovered_at": "2025-08-15T17:11:03.945332+00:00Z",
      "impact": "medium",
      "insight": "Test insight 32"
    },
    {
      "area": "test_area_33",
      "confidence": 0.8,
      "discovered_at": "2025-08-15T17:11:03.945332+00:00Z",
      "impact": "medium",
      "insight": "Test insight 33"
    },
    {
      "area": "test_area_34",
      "confidence": 0.8,
      "discovered_at": "2025-08-15T17:11:03.945333+00:00Z",
      "impact": "medium",
      "insight": "Test insight 34"
    },
    {
      "area": "test_area_35",
      "confidence": 0.8,
      "discovered_at": "2025-08-15T17:11:03.945334+00:00Z",
      "impact": "medium",
      "insight": "Test insight 35"
    },
    {
      "area": "test_area_36",
      "confidence": 0.8,
      "discovered_at": "2025-08-15T17:11:03.945335+00:00Z",
      "impact": "medium",
      "insight": "Test insight 36"
    },
    {
      "area": "test_area_37",
      "confidence": 0.8,
      "discovered_at": "2025-08-15T17:11:03.945336+00:00Z",
      "impact": "medium",
      "insight": "Test insight 37"
    },
    {
      "area": "test_area_38",
      "confidence": 0.8,
      "discovered_at": "2025-08-15T17:11:03.945337+00:00Z",
      "impact": "medium",
      "insight": "Test insight 38"
    },
    {
      "area": "test_area_39",
      "confidence": 0.8,
      "discovered_at": "2025-08-15T17:11:03.945338+00:00Z",
      "impact": "medium",
      "insight": "Test insight 39"
    },
    {
      "area": "test_area_40",
      "confidence": 0.8,
      "discovered_at": "2025-08-15T17:11:03.945338+00:00Z",
      "impact": "medium",
      "insight": "Test insight 40"
    },
    {
      "area": "test_area_41",
      "confidence": 0.8,
      "discovered_at": "2025-08-15T17:11:03.945339+00:00Z",
      "impact": "medium",
      "insight": "Test insight 41"
    },
    {
      "area": "test_area_42",
      "confidence": 0.8,
      "discovered_at": "2025-08-15T17:11:03.945340+00:00Z",
      "impact": "medium",
      "insight": "Test insight 42"
    },
    {
      "area": "test_area_43",
      "confidence": 0.8,
      "discovered_at": "2025-08-15T17:11:03.945341+00:00Z",
      "impact": "medium",
      "insight": "Test insight 43"
    },
    {
      "area": "test_area_44",
      "confidence": 0.8,
      "discovered_at": "2025-08-15T17:11:03.945342+00:00Z",
      "impact": "medium",
      "insight": "Test insight 44"
    },
    {
      "area": "test_area_45",
      "confidence": 0.8,
      "discovered_at": "2025-08-15T17:11:03.945342+00:00Z",
      "impact": "medium",
      "insight": "Test insight 45"
    },
    {
      "area": "test_area_46",
      "confidence": 0.8,
      "discovered_at": "2025-08-15T17:11:03.945343+00:00Z",
      "impact": "medium",
      "insight": "Test insight 46"
    },
    {
      "area": "test_area_47",
      "confidence": 0.8,
      "discovered_at": "2025-08-15T17:11:03.945344+00:00Z",
      "impact": "medium",
      "insight": "Test insight 47"
    },
    {
      "area": "test_area_48",
      "confidence": 0.8,
      "discovered_at": "2025-08-15T17:11:03.945345+00:00Z",
      "impact": "medium",
      "insight": "Test insight 48"
    },
    {
      "area": "test_area_49",
      "confidence": 0.8,
      "discovered_at": "2025-08-15T17:11:03.945346+00:00Z",
      "impact": "medium",
      "insight": "Test insight 49"
    }
  ],
  "task_history": [
    {
      "delegations": [],
      "key_insights": [],
      "outcome": "success",
      "task_description": "Concurrent test 1",
      "task_id": "concurrent_test_1",
      "timestamp": "2025-08-15T17:11:04.264131+00:00Z"
    }
  ]
}