{
  "agent_name": "database-specialist",
  "collaboration_patterns": {
    "delegation_effectiveness": {},
    "frequent_collaborators": []
  },
  "domain_knowledge": {
    "common_patterns": [
      {
        "pattern_name": "pragmatic_database_validation",
        "description": "Validate database problems exist in production with real metrics before optimization",
        "frequency": 1,
        "success_rate": 0.95
      },
      {
        "pattern_name": "jsonb_optimization",
        "description": "JSONB schema design for ML metadata storage with sub-100ms response times",
        "frequency": 1,
        "success_rate": 0.90
      },
      {
        "pattern_name": "schema_first_design",
        "description": "Data structure design eliminates complex query logic and special-case handling",
        "frequency": 1,
        "success_rate": 0.92
      }
    ],
    "project_specific_context": {
      "architecture_patterns": [
        "PostgreSQL 15+ with JSONB optimization for ML metadata",
        "Connection pooling optimized for high-concurrency analytics",
        "Schema-first design eliminates complex transformation logic",
        "Real behavior testing with testcontainers for database validation"
      ],
      "configuration_insights": [
        "JSONB indexing strategies for flexible ML metadata queries",
        "Connection pool sizing based on real workload patterns",
        "Query simplicity through proper data modeling"
      ],
      "performance_baselines": {
        "query_response_time_ms": 100,
        "jsonb_query_performance_ms": 50,
        "connection_pool_efficiency": 0.95
      }
    }
  },
  "last_updated": "2025-08-15T17:11:04.296867+00:00Z",
  "optimization_insights": [
    {
      "area": "query_optimization",
      "confidence": 0.95,
      "discovered_at": "2025-01-15T00:00:00Z",
      "impact": "high",
      "insight": "JSONB optimization for ML metadata storage achieved sub-100ms response times through proper schema design"
    },
    {
      "area": "connection_pooling",
      "confidence": 0.90,
      "discovered_at": "2025-01-15T00:00:00Z",
      "impact": "high",
      "insight": "PostgreSQL connection pool optimization enabled high-concurrency analytics queries with minimal resource overhead"
    }
  ],
  "task_history": [
    {
      "delegations": [],
      "key_insights": [],
      "outcome": "success",
      "task_description": "Concurrent test 0",
      "task_id": "concurrent_test_0",
      "timestamp": "2025-08-15T17:11:04.261554+00:00Z"
    }
  ]
}