{
  "agent_name": "monitoring-observability-specialist",
  "collaboration_patterns": {
    "delegation_effectiveness": {},
    "frequent_collaborators": [
      {
        "agent_name": "performance-engineer",
        "collaboration_frequency": 6,
        "common_tasks": [
          "performance monitoring",
          "SLO validation"
        ],
        "success_rate": 0.93
      }
    ]
  },
  "domain_knowledge": {
    "common_patterns": [
      {
        "description": "OpenTelemetry distributed tracing and metrics collection",
        "frequency": 1,
        "pattern_name": "opentelemetry_instrumentation",
        "success_rate": 0.92
      },
      {
        "description": "SLO compliance monitoring with real performance measurements",
        "frequency": 1,
        "pattern_name": "slo_monitoring",
        "success_rate": 0.91
      }
    ],
    "project_specific_context": {
      "architecture_patterns": [
        "OpenTelemetry integration for distributed tracing",
        "SLO monitoring framework with performance validation",
        "Real-time metrics collection and alerting",
        "Unified observability across ML and analytics systems"
      ],
      "configuration_insights": [
        "Comprehensive observability for ML analytics pipeline",
        "Performance monitoring integrated with caching layers",
        "Real-time SLO validation with automated alerting"
      ],
      "performance_baselines": {
        "alert_response_time_seconds": 30,
        "metrics_ingestion_rate": 10000,
        "trace_collection_latency_ms": 10
      }
    }
  },
  "last_updated": "2025-08-15T17:03:14.779149+00:00Z",
  "optimization_insights": [],
  "task_history": [
    {
      "delegations": [],
      "key_insights": [
        "Query optimized successfully"
      ],
      "outcome": "success",
      "task_description": "Agent task completed with success outcome",
      "task_id": "3b12253d-8599-468a-ba13-3bfffea87be1",
      "timestamp": "2025-08-15T17:03:14.779146+00:00Z"
    }
  ]
}